{
  "$schema": "http://json-schema.org/draft-07/schema#",
  "$id": "https://j0nathan-ll0yd.github.io/scripts/audit/specs/rule.schema.json",
  "title": "B2 spec/eval rule file",
  "description": "One finding-id's specification: the spec clause it derives from (or the declared absence of one), the severity the validator must emit, and the case inputs that make the rule discriminate. See decisions/0011 for the design rationale.",
  "type": "object",
  "additionalProperties": false,
  "required": ["id", "title", "artifact", "rule_class", "severity", "spec", "applicability", "expectation"],
  "properties": {
    "id": {
      "type": "string",
      "minLength": 1,
      "pattern": "^[a-z][a-z0-9-]*$",
      "description": "The finding id this rule specifies. Must match the id string emit() is called with."
    },
    "title": {"type": "string", "minLength": 1},
    "artifact": {"type": "string", "minLength": 1},
    "rule_class": {
      "enum": ["conformance", "local-policy", "convention", "operational"],
      "description": "conformance: a MUST in a spec that has a real conformance concept. local-policy: the spec sets a weaker/no threshold and we impose a stricter operational one. convention: the artifact's spec has no conformance concept at all (spec.conformance_testable must be false). operational: no external spec clause and no pure-function input can produce the condition (transport/fetch failures) -- cases are omitted and untested_rationale is required instead."
    },
    "severity": {
      "enum": ["fail", "warn"],
      "description": "No default. A rule file that omits this is invalid -- an implicit default would silently re-open the historical severity hole (SEV1)."
    },
    "params": {
      "type": "object",
      "description": "Thresholds this rule contributes to the PRODUCTION call path (not merely to a test). Absence for a rule that genuinely has a threshold must be declared via params_pending instead of silently omitted."
    },
    "params_pending": {
      "type": "string",
      "minLength": 1,
      "description": "Declares that this rule has an operative threshold that is NOT yet derived from params, and why (e.g. the constant is shared with an out-of-scope validator). Tracked by the params_pending ratchet in check-spec-severity.mjs -- the count may not increase."
    },
    "untested_rationale": {
      "type": "string",
      "minLength": 1,
      "description": "Required for rule_class: operational. States why no pure-function case can exercise this id and what does cover it instead (e.g. a smoke-suite route assertion)."
    },
    "spec": {
      "type": "object",
      "additionalProperties": false,
      "required": ["name", "clause", "url", "version", "conformance_testable", "retrieved", "content_sha256", "normative_quote", "verified_against_source"],
      "properties": {
        "name": {"type": "string", "minLength": 1},
        "clause": {"type": "string", "minLength": 1},
        "url": {"type": "string", "pattern": "^https://"},
        "version": {"type": "string", "minLength": 1},
        "conformance_testable": {
          "type": "boolean",
          "description": "Whether the cited spec has a real pass/fail conformance concept for this clause. rule_class: conformance requires this to be true -- forbids dressing local opinion as a standard (0010's lesson)."
        },
        "retrieved": {"type": "string", "minLength": 1},
        "content_sha256": {
          "type": "string",
          "pattern": "^[a-f0-9]{64}$",
          "description": "sha256 of this file's own normative_quote, computed at authoring time (see scripts/audit/specs/hash-normative-quotes.mjs). The external drift probe that re-fetches spec.url and compares is deferred to a follow-up PR (ADR 0011 follow-up (h)); until it lands this field is recorded but not verified."
        },
        "normative_quote": {"type": "string", "minLength": 1},
        "note": {"type": "string"},
        "verified_against_source": {
          "type": "boolean",
          "description": "Whether normative_quote has been transcribed and checked, character-for-character, against the primary source at verification_url. This is the checkable promotion of the prose disclosure ADR 0011's citation sweep found in 13 of 24 rule files but could not enforce ('recalled from training-data familiarity' vs 'verified against a live fetch') -- the defect rate tracked exactly the claims that skipped verification (7 of 7 conformance rules defective on first authoring). rule_class: conformance REQUIRES this true (see the conformance branch in the top-level allOf): a rule asserting an external MUST may not ship on unverified authority. A rule that cites no external clause (spec.clause 'n/a' -- rule_class: operational, or a purely local threshold) sets this false with a verification_note saying so; false honestly means 'no external-source claim was verified', which is exactly correct when there is no external clause to verify. Such a rule is never forced to claim true."
        },
        "verified_at": {
          "type": "string",
          "minLength": 1,
          "description": "ISO-8601 date normative_quote was checked against verification_url. Required when verified_against_source is true (see the spec-level allOf); omitted otherwise."
        },
        "verification_url": {
          "type": "string",
          "pattern": "^https://",
          "description": "The IMMUTABLE or commit-pinned source actually fetched and transcribed from when verified_against_source is true: an RFC's canonical plaintext (https://www.rfc-editor.org/rfc/rfcNNNN.txt) or a raw.githubusercontent.com blob pinned to a full 40-hex commit SHA. Distinct from spec.url, which may be a living HTML page that drifts. ADR 0011 follow-up (b): a hash-and-compare drift probe only works against an immutable target, so living sources (llmstxt.org -> AnswerDotAI/llms-txt; JSON Feed -> manton/JSONFeed) MUST be pinned to a SHA here, not cited by their living URL. check-spec-verification.mjs asserts this immutable/pinned shape. Required when verified_against_source is true."
        },
        "verification_note": {
          "type": "string",
          "minLength": 1,
          "description": "Required when verified_against_source is false (see the spec-level allOf): states why. Either 'no external clause to verify' (spec.clause 'n/a' -- normative_quote is a self-authored statement about the ABSENCE of external coverage, e.g. operational transport-failure ids or a purely local threshold) or an honest 'not yet checked' pending note."
        }
      },
      "allOf": [
        {
          "if": {"required": ["verified_against_source"], "properties": {"verified_against_source": {"const": true}}},
          "then": {"required": ["verified_at", "verification_url"]}
        },
        {
          "if": {"required": ["verified_against_source"], "properties": {"verified_against_source": {"const": false}}},
          "then": {"required": ["verification_note"]}
        }
      ]
    },
    "applicability": {"type": "string", "minLength": 1},
    "expectation": {"type": "string", "minLength": 1},
    "policy_note": {"type": "string"},
    "cases": {
      "type": "array",
      "items": {
        "type": "object",
        "additionalProperties": false,
        "required": ["name", "outcome", "input_file", "input_kind", "expect"],
        "properties": {
          "name": {"type": "string", "minLength": 1},
          "outcome": {"enum": ["passed", "failed", "inapplicable", "cantTell"]},
          "input_file": {
            "type": "string",
            "minLength": 1,
            "description": "Path to the case input, resolved relative to this rule file's own directory (not the repo root, and not process.cwd())."
          },
          "input_kind": {"enum": ["text", "json"]},
          "now": {
            "type": "string",
            "description": "ISO-8601 instant passed to the validator as `now`, for time-sensitive rules. Omitted for validators with no time dependency."
          },
          "expect": {
            "type": "array",
            "description": "The FULL set of {id, severity} pairs the validator emits for this input -- order-insensitive multiset equality, not a subset assertion. An id may repeat if the validator legitimately emits it more than once for this input.",
            "items": {
              "type": "object",
              "additionalProperties": false,
              "required": ["id", "severity"],
              "properties": {
                "id": {"type": "string", "minLength": 1},
                "severity": {"enum": ["fail", "warn"]}
              }
            }
          }
        }
      }
    }
  },
  "allOf": [
    {
      "if": {"required": ["rule_class"], "properties": {"rule_class": {"const": "conformance"}}},
      "then": {
        "properties": {
          "severity": {"const": "fail"},
          "spec": {"properties": {"conformance_testable": {"const": true}, "verified_against_source": {"const": true}}}
        }
      }
    },
    {
      "if": {"required": ["rule_class"], "properties": {"rule_class": {"const": "operational"}}},
      "then": {
        "required": ["untested_rationale"],
        "not": {"required": ["cases"]}
      }
    },
    {
      "if": {
        "required": ["rule_class"],
        "properties": {"rule_class": {"enum": ["conformance", "local-policy", "convention"]}}
      },
      "then": {
        "required": ["cases"],
        "properties": {
          "cases": {
            "type": "array",
            "allOf": [
              {
                "contains": {"type": "object", "properties": {"outcome": {"const": "failed"}}},
                "description": "(i) at least one case demonstrates this rule can fail"
              },
              {
                "contains": {"type": "object", "properties": {"outcome": {"enum": ["passed", "inapplicable"]}}},
                "description": "(ii) at least one case demonstrates this rule can pass or not apply"
              }
            ]
          }
        }
      }
    }
  ]
}
