{
  "id": "index-md-freshness-unknown",
  "title": "index.md freshness could not be determined",
  "artifact": "llms.txt",
  "rule_class": "operational",
  "severity": "warn",
  "untested_rationale": "checkPresence() emits this exact id only on its live HTTP path, so the operational rule has no catalog cases. The missing/invalid timestamp behavior itself is now exercised without network by compositionTimestamp() and evaluateLlmsCoherence() in tests/audit/llms-coherence.test.ts; the weekly coherence check applies it to the live origin and canonical response.",
  "spec": {
    "name": "llms.txt (llmstxt.org)",
    "clause": "n/a",
    "url": "https://llmstxt.org/",
    "version": "llmstxt.org (as documented in validate-llms-txt.mjs, retrieved 2026-07-16)",
    "conformance_testable": false,
    "retrieved": "2026-07-29",
    "content_sha256": "3854ce23d5f0cc47181df7dc8634359ff273a22d1a99132c0df3691b66c483bd",
    "normative_quote": "index.md has no formal spec of its own; this id covers this repo's own freshness-determination fallback logic.",
    "note": "No spec clause applies -- conformance_testable is false by construction, matching rule_class: operational.",
    "verified_against_source": false,
    "verification_note": "clause n/a -- rule_class: operational. normative_quote is a self-authored statement about the ABSENCE of external spec coverage for this transport/fetch/presence condition; there is no external normative clause to transcribe or verify against a source."
  },
  "applicability": "N/A -- fires when no freshness signal is present in a live HTTP response.",
  "expectation": "N/A -- see untested_rationale."
}
