{
  "id": "feed-xml-channel-field",
  "title": "the RSS channel must contain title, link, and description",
  "artifact": "feed.xml",
  "rule_class": "conformance",
  "severity": "fail",
  "spec": {
    "name": "RSS 2.0",
    "clause": "Required channel elements",
    "url": "https://www.rssboard.org/rss-specification",
    "version": "RSS 2.0.11 (March 30, 2009)",
    "conformance_testable": true,
    "retrieved": "2026-08-22",
    "content_sha256": "7f4126a5c8144b955197322443805adb7d9195dfc0fbd37bd2ced77d40d54ade",
    "normative_quote": "Here's a list of the required channel elements, each with a brief description, an example, and where available, a pointer to a more complete description.... title The name of the channel.... link The URL to the HTML website corresponding to the channel.... description Phrase or sentence describing the channel.",
    "note": "Separate table passages are joined with ellipses and checked in source order.",
    "verified_against_source": true,
    "verified_at": "2026-08-22",
    "verification_url": "https://www.rssboard.org/rss-2-0-11"
  },
  "applicability": "The <channel> element of a parsed RSS 2.0 document.",
  "expectation": "The channel contains non-empty title, link, and description elements.",
  "cases": [
    {
      "name": "a channel missing link and description emits one finding per field",
      "outcome": "failed",
      "input_file": "cases/missing-channel-fields.xml",
      "input_kind": "text",
      "now": "2026-07-16T00:00:00.000Z",
      "expect": [
        {
          "id": "feed-xml-channel-field",
          "severity": "fail"
        },
        {
          "id": "feed-xml-channel-field",
          "severity": "fail"
        }
      ]
    },
    {
      "name": "a conformant, fresh RSS document",
      "outcome": "passed",
      "input_file": "cases/valid.xml",
      "input_kind": "text",
      "now": "2026-07-16T00:00:00.000Z",
      "expect": []
    }
  ]
}
