{
  "id": "llms-txt-second-h1",
  "title": "Only one H1 is allowed",
  "artifact": "llms.txt",
  "rule_class": "convention",
  "severity": "fail",
  "spec": {
    "name": "llms.txt (llmstxt.org)",
    "clause": "Format section, item 2",
    "url": "https://llmstxt.org/",
    "version": "llmstxt.org (as documented in validate-llms-txt.mjs, retrieved 2026-07-16)",
    "conformance_testable": false,
    "retrieved": "2026-07-29",
    "content_sha256": "54213ead2ea14da262d557f5c42b32293ce36bafcf7c50606e85aa28014946dd",
    "normative_quote": "An H1 with the name of the project or site. This is the only required section",
    "note": "The spec describes exactly one H1; a second H1 is a local structural convention we enforce, not a spec-tested conformance failure -- conformance_testable is false. Verified against the pinned source (AnswerDotAI/llms-txt @c7178b9, nbs/index.qmd) on 2026-07-30: the quote is exact (Format list item 2). Source line 42 has no trailing period; a stray one was removed in this review pass.",
    "verified_against_source": true,
    "verified_at": "2026-07-30",
    "verification_url": "https://raw.githubusercontent.com/AnswerDotAI/llms-txt/c7178b9dcdbf696517f52b2d3126e417eb95fd59/nbs/index.qmd"
  },
  "policy_note": "llmstxt.org never states a prohibition on a second H1 -- 'this is the only required section' means the H1 is the only mandatory element, not that no other H1-level heading may appear. The prohibition this rule enforces is entirely our own inference (required does not imply exclusive); the source text contains no such rule. rule_class stays convention / conformance_testable stays false, which is the intended, correctly-modeled outcome.",
  "applicability": "An llms.txt body that already has a valid H1.",
  "expectation": "No further line matches /^#\\s+\\S/.",
  "cases": [
    {
      "name": "a second H1 appears after the first",
      "outcome": "failed",
      "input_file": "cases/second-h1.txt",
      "input_kind": "text",
      "expect": [
        {
          "id": "llms-txt-second-h1",
          "severity": "fail"
        }
      ]
    },
    {
      "name": "a fully spec-conformant file",
      "outcome": "passed",
      "input_file": "../../../../tests/audit/fixtures/llms-valid.txt",
      "input_kind": "text",
      "expect": []
    }
  ]
}
