{
  "id": "security-txt-canonical-missing",
  "title": "security.txt should declare the URI it is served from as Canonical",
  "artifact": "security.txt",
  "rule_class": "local-policy",
  "severity": "warn",
  "spec": {
    "name": "RFC 9116",
    "clause": "§2.5.2",
    "url": "https://www.rfc-editor.org/rfc/rfc9116",
    "version": "RFC 9116 (April 2022)",
    "conformance_testable": false,
    "retrieved": "2026-08-31",
    "content_sha256": "9238f74a4dc70542e3c580c895dfc4270b3bbff63a931b9b294754ea9c7de0c5",
    "normative_quote": "The \"Canonical\" field indicates the canonical URIs where the \"security.txt\" file is located, which is usually something like \"https://example.com/.well-known/security.txt\".",
    "note": "Transcribed from a live fetch of https://www.rfc-editor.org/rfc/rfc9116.txt on 2026-08-31. conformance_testable is false on purpose: §2.5 states 'Unless otherwise stated, all fields MUST be considered optional', and §2.5.2 states no exception, so RFC 9116 imposes NO obligation to publish a Canonical field. The quote is descriptive, and the obligation this rule enforces is local -- see policy_note.",
    "verified_against_source": true,
    "verified_at": "2026-08-31",
    "verification_url": "https://www.rfc-editor.org/rfc/rfc9116.txt"
  },
  "policy_note": "RFC 9116 does not require Canonical. This repo publishes one anyway, and this rule guards that choice, because §2.5.2 ties consumer trust to the retrieval URI appearing among the canonical fields (see security-txt-canonical-mismatch): with no Canonical field at all, a researcher can never make that determination for our file. Severity is warn, not fail -- an absent optional field is a regression against our own policy, not a broken artifact, so it must be visible without failing the audit (lib/http.mjs reports warns and exits 0). Fail is reserved for the mismatch case, where a Canonical field is present and actively points elsewhere.",
  "applicability": "A security.txt body of any length.",
  "expectation": "The body contains at least one line matching /^Canonical:[ \\t]*\\S/ (case-insensitive, per-line).",
  "cases": [
    {
      "name": "no Canonical field",
      "outcome": "failed",
      "input_file": "cases/no-canonical.txt",
      "input_kind": "text",
      "now": "2026-07-16T00:00:00.000Z",
      "expect": [
        {
          "id": "security-txt-canonical-missing",
          "severity": "warn"
        }
      ]
    },
    {
      "name": "Canonical present and correct -- this rule does not fire",
      "outcome": "passed",
      "input_file": "cases/expires-400d.txt",
      "input_kind": "text",
      "now": "2026-07-16T00:00:00.000Z",
      "expect": []
    },
    {
      "name": "Canonical present but pointing elsewhere -- this rule does not fire, security-txt-canonical-mismatch does",
      "outcome": "passed",
      "input_file": "cases/canonical-mismatch.txt",
      "input_kind": "text",
      "now": "2026-07-16T00:00:00.000Z",
      "expect": [
        {
          "id": "security-txt-canonical-mismatch",
          "severity": "fail"
        }
      ]
    }
  ]
}
